{
  "schemaVersion": 1,
  "contractVersion": "TBD_GATE_0",
  "baseCommit": "14310d34e882969208bb7583c5e0c8442bfc3aee",
  "owner": "A1",
  "assets": [
    {
      "id": "machine_pop_pair_body",
      "status": "PLANNED",
      "category": "machine",
      "stageUse": [
        2,
        3
      ],
      "file": null,
      "width": null,
      "height": null,
      "anchor": null,
      "sourceFile": null,
      "sha256": null,
      "provenanceRef": null,
      "reuseSource": null,
      "alphaMode": "TBD",
      "notes": "Template only: no generated image exists. Replace nulls from actual export, never invent dimensions or hashes."
    }
  ]
}
